High-school Track,R,I,A,S,E,C,Skills,Courses and Certificates,Work Style,Passion and Goals,Faculty,Typical Degree,Program/Major,Primary Campus
Sociology and Economics,False,False,False,False,False,True,"Accounting Software, Analysis, Excel, Research","Managerial Accounting, Auditing, mother Workshop",Office/Data,"numbers, to create",Faculty of Economics & Business Administration,BS,Accounting,Multiple branches
Sociology and Economics,False,False,False,False,False,True,"Analysis, Organization, Arabic","Managerial Accounting, Financial Accounting, IELTS",Office/Data,"corporate, to help people",Faculty of Economics & Business Administration,BS,Accounting,Multiple branches
Sociology and Economics,False,False,False,False,False,True,"Mathematics, Excel, Accounting Software, Attention to Detail, Communication, Microsoft Office","Financial Accounting, TOEFL",Office/Data,"corporate, to understand",Faculty of Economics & Business Administration,BS,Accounting,Multiple branches
Sociology and Economics,False,False,False,False,False,True,"Organization, Mathematics, English","Auditing, Taxation, IELTS",Office/Data,"corporate, to help people",Faculty of Economics & Business Administration,BS,Accounting,Multiple branches
Sociology and Economics,False,False,False,False,False,True,"Analysis, Attention to Detail, Mathematics, Organization, French","Auditing, TOEFL",Office/Data,"numbers, to create",Faculty of Economics & Business Administration,BS,Accounting,Multiple branches
Sociology and Economics,False,False,False,False,False,True,"Organization, Excel, English","Bookkeeping, TOEFL",Office/Data,"organization, to build",Faculty of Economics & Business Administration,BS,Accounting,Multiple branches
Sociology and Economics,True,False,False,False,False,False,"Excel, Mathematics, Analysis, Communication, French","Taxation, Bookkeeping, IELTS",Office/Data,"accuracy, to understand",Faculty of Economics & Business Administration,BS,Accounting,Multiple branches
Sociology and Economics,False,False,False,False,False,True,"Mathematics, Accounting Software, English","Auditing, Summer Program",Office/Data,"numbers, to research",Faculty of Economics & Business Administration,BS,Accounting,Multiple branches
Sociology and Economics,False,True,False,False,False,True,"Accounting Software, Attention to Detail, Organization, Communication, Microsoft Office","Financial Accounting, Auditing, First Aid",Office/Data,"organization, career",Faculty of Economics & Business Administration,BS,Accounting,Multiple branches
Sociology and Economics,True,True,False,False,False,True,"Attention to Detail, Excel, Analysis, Microsoft Office, Communication","Taxation, director Workshop",Office/Data,"accuracy, to help people",Faculty of Economics & Business Administration,BS,Accounting,Multiple branches
Sociology and Economics,False,False,True,False,False,True,"Mathematics, Analysis, Microsoft Office, Time Management","Managerial Accounting, Auditing, Summer Program",Office/Data,"auditing, to create",Faculty of Economics & Business Administration,BS,Accounting,Multiple branches
Sociology and Economics,False,False,False,False,False,True,"Analysis, Accounting Software, Attention to Detail, Organization, Arabic, Time Management","Bookkeeping, Taxation, TOEFL",Office/Data,"organization, to create",Faculty of Economics & Business Administration,BS,Accounting,Multiple branches
Sociology and Economics,False,False,False,False,False,True,"Mathematics, Attention to Detail, Analysis, Communication","Managerial Accounting, Auditing, arm Workshop",Office/Data,"accuracy, to build",Faculty of Economics & Business Administration,BS,Accounting,Multiple branches
Sociology and Economics,False,False,False,False,False,True,"Organization, Attention to Detail, Microsoft Office, Communication","Financial Accounting, Managerial Accounting, stock Workshop",Office/Data,"auditing, to innovate",Faculty of Economics & Business Administration,BS,Accounting,Multiple branches
Sociology and Economics,False,True,False,True,True,True,"Statistics, Mathematics, Analysis, Excel, Time Management","Risk Management, Corporate Finance, some Workshop",Office/Data,"wealth management, to help people",Faculty of Economics & Business Administration,BS,Finance,Multiple branches
Sociology and Economics,False,True,False,False,True,True,"Analysis, Mathematics, English","Investments, assume Workshop","Office/Data, Business","investments, to research",Faculty of Economics & Business Administration,BS,Finance,Multiple branches
Sociology and Economics,True,True,False,False,True,True,"Analysis, Mathematics, Statistics, Microsoft Office","Financial Markets, TOEFL",Office/Data,"economics, to understand",Faculty of Economics & Business Administration,BS,Finance,Multiple branches
Sociology and Economics,False,True,False,False,False,True,"Mathematics, Economics, Excel, Statistics, English, Microsoft Office","Economic Analysis, Financial Markets, IELTS",Office/Data,"investments, career",Faculty of Economics & Business Administration,BS,Finance,Multiple branches
Sociology and Economics,False,True,False,False,True,True,"Economics, Statistics, Analysis, English","Corporate Finance, Risk Management, ICDL","Office/Data, Business","investments, to innovate",Faculty of Economics & Business Administration,BS,Finance,Multiple branches
Sociology and Economics,False,True,False,False,True,True,"Statistics, Excel, Mathematics, Time Management, Communication","Risk Management, Summer Program",Office/Data,"analysis, career",Faculty of Economics & Business Administration,BS,Finance,Multiple branches
Sociology and Economics,False,True,False,False,True,True,"Economics, Mathematics, Analysis, Research","Financial Markets, Investments, threat Workshop",Office/Data,"markets, career",Faculty of Economics & Business Administration,BS,Finance,Multiple branches
Sociology and Economics,False,True,True,False,False,False,"Mathematics, Risk Assessment, Research, English","Investments, reduce Workshop",Office/Data,"investments, to research",Faculty of Economics & Business Administration,BS,Finance,Multiple branches
Sociology and Economics,False,True,False,False,True,True,"Economics, Excel, Statistics, Risk Assessment, Time Management","Investments, Financial Markets, usually Workshop",Office/Data,"markets, career",Faculty of Economics & Business Administration,BS,Finance,Multiple branches
Sociology and Economics,False,True,False,False,True,True,"Statistics, Analysis, Microsoft Office","Financial Markets, Summer Program","Office/Data, Business","markets, to research",Faculty of Economics & Business Administration,BS,Finance,Multiple branches
Sociology and Economics,True,True,False,False,True,True,"Economics, Statistics, Time Management","Risk Management, Corporate Finance, IELTS",Office/Data,"financial planning, to lead",Faculty of Economics & Business Administration,BS,Finance,Multiple branches
Sociology and Economics,False,True,False,False,False,True,"Mathematics, Economics, English, Microsoft Office","Economic Analysis, trouble Workshop","Office/Data, Business","investments, to understand",Faculty of Economics & Business Administration,BS,Finance,Multiple branches
Sociology and Economics,False,True,False,False,True,True,"Statistics, Excel, Analysis, Communication","Corporate Finance, Investments, may Workshop",Office/Data,"wealth management, to create",Faculty of Economics & Business Administration,BS,Finance,Multiple branches
Sociology and Economics,False,False,False,True,True,False,"Economics, Risk Assessment, Mathematics, Microsoft Office, Time Management","Corporate Finance, Risk Management, First Aid",Office/Data,"wealth management, to build",Faculty of Economics & Business Administration,BS,Finance,Multiple branches
Sociology and Economics,False,True,False,False,True,False,"Statistics, Excel, Microsoft Office, Time Management","Investments, Risk Management, IELTS",Office/Data,"investments, to help people",Faculty of Economics & Business Administration,BS,Finance,Multiple branches
Sociology and Economics,False,True,False,False,True,True,"Risk Assessment, Analysis, Statistics, Economics, Arabic, English","Economic Analysis, IELTS","Office/Data, Business","analysis, to research",Faculty of Economics & Business Administration,BS,Finance,Multiple branches
Sociology and Economics,False,True,False,False,True,True,"Economics, Analysis, Microsoft Office, Arabic","Economic Analysis, Risk Management, First Aid",Office/Data,"wealth management, to help people",Faculty of Economics & Business Administration,BS,Finance,Multiple branches
Sociology and Economics,True,True,False,False,True,True,"Risk Assessment, Excel, Analysis, French","Risk Management, Corporate Finance, Summer Program",Office/Data,"economics, to create",Faculty of Economics & Business Administration,BS,Finance,Multiple branches
Sociology and Economics,False,False,True,False,True,False,"Communication, Social Media, Creativity, Research, Research","Consumer Behavior, ICDL",Business,"social media, to create",Faculty of Economics & Business Administration,BS,Marketing,Multiple branches
Sociology and Economics,False,False,True,True,True,False,"Creativity, Research, Time Management, French","Marketing Principles, Brand Management, Summer Program","Business, Creative/Design","social media, to lead",Faculty of Economics & Business Administration,BS,Marketing,Multiple branches
Sociology and Economics,False,False,True,False,True,False,"Communication, Creativity, Strategy, Social Media, English","Consumer Behavior, IELTS",Business,"advertising, to create",Faculty of Economics & Business Administration,BS,Marketing,Multiple branches
Sociology and Economics,False,False,True,False,True,False,"Communication, Strategy, Creativity, Time Management","Marketing Principles, ICDL",Business,"sales, to innovate",Faculty of Economics & Business Administration,BS,Marketing,Multiple branches
Sociology and Economics,False,False,False,False,True,False,"Strategy, Communication, Presentation, Research, Microsoft Office","Digital Marketing, Market Research, ICDL","Business, Creative/Design","sales, to build",Faculty of Economics & Business Administration,BS,Marketing,Multiple branches
Sociology and Economics,False,False,True,False,True,False,"Presentation, Creativity, French","Consumer Behavior, Marketing Principles, Summer Program",Business,"strategy, to create",Faculty of Economics & Business Administration,BS,Marketing,Multiple branches
Sociology and Economics,False,False,True,False,True,False,"Strategy, Creativity, Research, Social Media, Arabic, Research","Brand Management, IELTS","Business, Creative/Design","social media, to understand",Faculty of Economics & Business Administration,BS,Marketing,Multiple branches
Sociology and Economics,False,False,True,False,True,False,"Presentation, Strategy, Arabic, French","Marketing Principles, ICDL",Business,"sales, to lead",Faculty of Economics & Business Administration,BS,Marketing,Multiple branches
Sociology and Economics,False,False,True,False,True,False,"Social Media, Research, Presentation, Time Management","Brand Management, First Aid",Business,"social media, to help people",Faculty of Economics & Business Administration,BS,Marketing,Multiple branches
Sociology and Economics,False,False,True,False,True,False,"Creativity, Presentation, Research, Microsoft Office, French","Marketing Principles, Digital Marketing, ICDL",Business,"brands, career",Faculty of Economics & Business Administration,BS,Marketing,Multiple branches
Sociology and Economics,True,False,True,False,True,False,"Strategy, Presentation, Arabic","Digital Marketing, Summer Program",Business,"brands, to research",Faculty of Economics & Business Administration,BS,Marketing,Multiple branches
Sociology and Economics,False,False,True,False,True,False,"Presentation, Strategy, Research, Microsoft Office","Consumer Behavior, ICDL","Business, Creative/Design","social media, to lead",Faculty of Economics & Business Administration,BS,Marketing,Multiple branches
Sociology and Economics,False,False,True,False,True,False,"Communication, Presentation, Strategy, French","Market Research, Summer Program",Business,"strategy, to lead",Faculty of Economics & Business Administration,BS,Marketing,Multiple branches
Sociology and Economics,False,False,True,False,True,False,"Presentation, Strategy, Research, English","Marketing Principles, Market Research, may Workshop","Business, Creative/Design","brands, to build",Faculty of Economics & Business Administration,BS,Marketing,Multiple branches
Sociology and Economics,False,False,True,False,True,False,"Communication, Creativity, Strategy, Arabic","Brand Management, ICDL",Business,"strategy, to lead",Faculty of Economics & Business Administration,BS,Marketing,Multiple branches
Sociology and Economics,False,False,True,True,True,False,"Presentation, Social Media, Communication, Communication, French","Consumer Behavior, Market Research, Summer Program",Business,"social media, to innovate",Faculty of Economics & Business Administration,BS,Marketing,Multiple branches
Sociology and Economics,False,False,True,False,False,False,"Social Media, Communication, French","Consumer Behavior, Market Research, ICDL","Business, Creative/Design","brands, to build",Faculty of Economics & Business Administration,BS,Marketing,Multiple branches
Sociology and Economics,False,False,True,False,True,False,"Creativity, Social Media, Communication, English","Digital Marketing, Consumer Behavior, Summer Program",Business,"consumer trends, to innovate",Faculty of Economics & Business Administration,BS,Marketing,Multiple branches
Life Science,True,True,False,False,False,False,"Problem Solving, Soil Science, Chemistry, Mechanics, Microsoft Office","Irrigation Systems, IELTS",Hands-on/Field,"machinery, to research",Faculty of Agronomy,"BSc, MSc, PhD",Agricultural Engineering,Distributed across branches
Life Science,True,True,False,False,False,False,"Biology, Chemistry, Problem Solving, French, English","Soil Mechanics, Summer Program",Hands-on/Field,"sustainability, to research",Faculty of Agronomy,"BSc, MSc, PhD",Agricultural Engineering,Distributed across branches
Life Science,True,True,False,False,False,False,"Problem Solving, Mathematics, Mechanics, Research","Irrigation Systems, Plant Pathology, First Aid","Hands-on/Field, Lab/Research","crops, career",Faculty of Agronomy,"BSc, MSc, PhD",Agricultural Engineering,Distributed across branches
Life Science,True,True,False,False,False,False,"Mechanics, Problem Solving, French","Plant Pathology, Crop Science, chair Workshop",Hands-on/Field,"crops, to create",Faculty of Agronomy,"BSc, MSc, PhD",Agricultural Engineering,Distributed across branches
Life Science,True,True,False,False,False,False,"Soil Science, Chemistry, Research, Arabic","Soil Mechanics, Crop Science, ICDL","Hands-on/Field, Lab/Research","farming technology, to help people",Faculty of Agronomy,"BSc, MSc, PhD",Agricultural Engineering,Distributed across branches
Life Science,True,True,False,False,False,False,"Chemistry, Problem Solving, English, Arabic","Soil Mechanics, Irrigation Systems, Summer Program",Hands-on/Field,"farming technology, to create",Faculty of Agronomy,"BSc, MSc, PhD",Agricultural Engineering,Distributed across branches
Life Science,True,True,False,True,False,True,"Problem Solving, Chemistry, Mechanics, Mathematics, French","Agricultural Machinery, defense Workshop","Hands-on/Field, Lab/Research","innovation, to lead",Faculty of Agronomy,"BSc, MSc, PhD",Agricultural Engineering,Distributed across branches
Life Science,True,True,False,False,False,False,"Mechanics, Soil Science, Microsoft Office","Agricultural Machinery, First Aid",Hands-on/Field,"sustainability, to help people",Faculty of Agronomy,"BSc, MSc, PhD",Agricultural Engineering,Distributed across branches
Life Science,True,True,False,False,False,False,"Mechanics, Biology, Problem Solving, Mathematics, English, Research","Agricultural Machinery, ICDL","Hands-on/Field, Lab/Research","crops, to build",Faculty of Agronomy,"BSc, MSc, PhD",Agricultural Engineering,Distributed across branches
Life Science,True,True,False,False,False,False,"Mechanics, Biology, Mathematics, Soil Science, English, Arabic","Soil Mechanics, TOEFL",Hands-on/Field,"crops, to understand",Faculty of Agronomy,"BSc, MSc, PhD",Agricultural Engineering,Distributed across branches
Life Science,True,True,False,True,False,False,"Soil Science, Biology, Mathematics, Mechanics, Communication","Plant Pathology, TOEFL",Hands-on/Field,"food production, to create",Faculty of Agronomy,"BSc, MSc, PhD",Agricultural Engineering,Distributed across branches
Life Science,True,False,False,False,False,True,"Chemistry, Biology, Mathematics, Problem Solving, English","Crop Science, Irrigation Systems, Summer Program",Hands-on/Field,"food production, to innovate",Faculty of Agronomy,"BSc, MSc, PhD",Agricultural Engineering,Distributed across branches
Life Science,True,True,False,False,False,False,"Mechanics, Soil Science, Chemistry, Time Management","Soil Mechanics, IELTS","Hands-on/Field, Lab/Research","innovation, to build",Faculty of Agronomy,"BSc, MSc, PhD",Agricultural Engineering,Distributed across branches
Life Science,True,True,False,False,False,False,"Mathematics, Soil Science, Problem Solving, Mechanics, Research, French","Agricultural Machinery, TOEFL","Hands-on/Field, Lab/Research","farming technology, career",Faculty of Agronomy,"BSc, MSc, PhD",Agricultural Engineering,Distributed across branches
Life Science,True,False,False,False,False,False,"Chemistry, Mechanics, Problem Solving, Mathematics, French, Time Management","Agricultural Machinery, Plant Pathology, First Aid","Hands-on/Field, Lab/Research","sustainability, career",Faculty of Agronomy,"BSc, MSc, PhD",Agricultural Engineering,Distributed across branches
Life Science,True,False,False,False,False,False,"Chemistry, Biology, Mathematics, Problem Solving, Arabic","Soil Mechanics, Agricultural Machinery, Summer Program",Hands-on/Field,"crops, to help people",Faculty of Agronomy,"BSc, MSc, PhD",Agricultural Engineering,Distributed across branches
Life Science,True,True,True,False,False,False,"Biology, Mathematics, Communication","Soil Mechanics, Plant Pathology, First Aid","Hands-on/Field, Lab/Research","farming technology, career",Faculty of Agronomy,"BSc, MSc, PhD",Agricultural Engineering,Distributed across branches
Life Science,True,True,False,False,False,False,"Chemistry, Mechanics, Research","Crop Science, Soil Mechanics, Summer Program",Hands-on/Field,"crops, to help people",Faculty of Agronomy,"BSc, MSc, PhD",Agricultural Engineering,Distributed across branches
Life Science,True,True,False,False,True,False,"Plant Science, Data Analysis, Chemistry, Communication","Crop Production, Agricultural Economics, onto Workshop","Hands-on/Field, Lab/Research","plants, to create",Faculty of Agronomy,"BSc, MSc, PhD",Agronomy,Distributed across branches
Life Science,True,True,False,False,False,False,"Research, Biology, Chemistry, Plant Science, French, Time Management","Crop Production, TOEFL",Hands-on/Field,"crops, to understand",Faculty of Agronomy,"BSc, MSc, PhD",Agronomy,Distributed across branches
Life Science,True,True,False,False,True,False,"Biology, Chemistry, Communication","Crop Production, Entomology, First Aid",Hands-on/Field,"soil, to build",Faculty of Agronomy,"BSc, MSc, PhD",Agronomy,Distributed across branches
Life Science,True,True,False,False,True,False,"Plant Science, Biology, Sustainability, Time Management, Arabic","Crop Production, ICDL",Hands-on/Field,"sustainable agriculture, to innovate",Faculty of Agronomy,"BSc, MSc, PhD",Agronomy,Distributed across branches
Life Science,True,True,False,False,True,False,"Research, Plant Science, Time Management","Entomology, Soil Science, First Aid","Hands-on/Field, Lab/Research","plants, to build",Faculty of Agronomy,"BSc, MSc, PhD",Agronomy,Distributed across branches
Life Science,True,True,False,False,True,True,"Biology, Data Analysis, Chemistry, Sustainability, Microsoft Office, French","Plant Genetics, Crop Production, TOEFL",Hands-on/Field,"crops, career",Faculty of Agronomy,"BSc, MSc, PhD",Agronomy,Distributed across branches
Life Science,True,True,False,True,True,False,"Plant Science, Research, Time Management","Soil Science, First Aid",Hands-on/Field,"crops, to research",Faculty of Agronomy,"BSc, MSc, PhD",Agronomy,Distributed across branches
Life Science,True,False,False,False,True,False,"Research, Chemistry, Data Analysis, Sustainability, Arabic","Agricultural Economics, list Workshop",Hands-on/Field,"crops, to understand",Faculty of Agronomy,"BSc, MSc, PhD",Agronomy,Distributed across branches
Life Science,True,True,False,False,True,True,"Chemistry, Research, Plant Science, Biology, Microsoft Office","Entomology, First Aid",Hands-on/Field,"sustainable agriculture, to innovate",Faculty of Agronomy,"BSc, MSc, PhD",Agronomy,Distributed across branches
Life Science,True,True,False,False,False,False,"Chemistry, Sustainability, Microsoft Office, Arabic","Agricultural Economics, Summer Program",Hands-on/Field,"research, to help people",Faculty of Agronomy,"BSc, MSc, PhD",Agronomy,Distributed across branches
Life Science,True,True,False,False,True,False,"Research, Biology, Sustainability, Plant Science, Time Management, Communication","Entomology, hold Workshop","Hands-on/Field, Lab/Research","soil, to lead",Faculty of Agronomy,"BSc, MSc, PhD",Agronomy,Distributed across branches
Life Science,True,True,False,False,True,False,"Research, Chemistry, Data Analysis, Arabic","Agricultural Economics, Summer Program",Hands-on/Field,"research, to build",Faculty of Agronomy,"BSc, MSc, PhD",Agronomy,Distributed across branches
Life Science,True,True,False,False,True,False,"Sustainability, Biology, Plant Science, Arabic, French","Agricultural Economics, Summer Program",Hands-on/Field,"plants, to innovate",Faculty of Agronomy,"BSc, MSc, PhD",Agronomy,Distributed across branches
Life Science,True,False,False,False,True,False,"Plant Science, Biology, Research, Data Analysis, Microsoft Office","Entomology, IELTS",Hands-on/Field,"research, to research",Faculty of Agronomy,"BSc, MSc, PhD",Agronomy,Distributed across branches
Life Science,True,True,False,False,True,False,"Sustainability, Data Analysis, English, French","Agricultural Economics, Crop Production, cut Workshop","Hands-on/Field, Lab/Research","food security, to understand",Faculty of Agronomy,"BSc, MSc, PhD",Agronomy,Distributed across branches
Life Science,True,True,False,False,False,False,"Plant Science, Sustainability, Chemistry, Data Analysis, Arabic","Plant Genetics, Entomology, Summer Program",Hands-on/Field,"sustainable agriculture, to build",Faculty of Agronomy,"BSc, MSc, PhD",Agronomy,Distributed across branches
Life Science,True,True,False,False,False,False,"Sustainability, Chemistry, Biology, Research, French","Crop Production, Entomology, TOEFL",Hands-on/Field,"sustainable agriculture, to lead",Faculty of Agronomy,"BSc, MSc, PhD",Agronomy,Distributed across branches
Life Science,True,True,False,False,True,False,"Plant Science, Chemistry, French","Plant Genetics, Summer Program",Hands-on/Field,"research, to understand",Faculty of Agronomy,"BSc, MSc, PhD",Agronomy,Distributed across branches
Life Science,False,True,True,True,False,True,"Mathematics, Biology, Communication, Research","Biochemistry, ICDL","Lab/Research, People-centric/Teaching","wellness, to build",Faculty of Pharmacy,BS/PharmD,Pharmacy,Beirut/North
Life Science,False,True,False,True,False,True,"Biology, Attention to Detail, Arabic","Pharmaceutics, Biochemistry, Summer Program",Lab/Research,"chemistry, career",Faculty of Pharmacy,BS/PharmD,Pharmacy,Beirut/North
Life Science,False,True,False,False,False,True,"Mathematics, Biology, Attention to Detail, Research, English","Medicinal Chemistry, Pharmacotherapy, back Workshop","Lab/Research, People-centric/Teaching","research, to build",Faculty of Pharmacy,BS/PharmD,Pharmacy,Beirut/North
Life Science,False,True,False,True,False,True,"Biology, Mathematics, Analysis, Communication, Arabic","Biochemistry, TOEFL",Lab/Research,"chemistry, to lead",Faculty of Pharmacy,BS/PharmD,Pharmacy,Beirut/North
Life Science,False,True,False,False,False,True,"Communication, Mathematics, Communication","Pharmacotherapy, Medicinal Chemistry, political Workshop","Lab/Research, People-centric/Teaching","healthcare, to lead",Faculty of Pharmacy,BS/PharmD,Pharmacy,Beirut/North
Life Science,False,False,False,True,False,True,"Chemistry, Communication, Analysis, Attention to Detail, Research, French","Pharmaceutics, Pharmacotherapy, TOEFL",Lab/Research,"wellness, career",Faculty of Pharmacy,BS/PharmD,Pharmacy,Beirut/North
Life Science,False,False,False,True,False,True,"Mathematics, Analysis, Chemistry, Microsoft Office, French","Pharmacology, Medicinal Chemistry, TOEFL","Lab/Research, People-centric/Teaching","chemistry, to research",Faculty of Pharmacy,BS/PharmD,Pharmacy,Beirut/North
Life Science,False,False,True,True,False,True,"Chemistry, Attention to Detail, Biology, French","Medicinal Chemistry, Pharmacotherapy, ICDL",Lab/Research,"wellness, to lead",Faculty of Pharmacy,BS/PharmD,Pharmacy,Beirut/North
Life Science,False,True,False,True,False,True,"Attention to Detail, Analysis, Mathematics, Microsoft Office, Research","Pharmaceutics, Summer Program",Lab/Research,"healthcare, to innovate",Faculty of Pharmacy,BS/PharmD,Pharmacy,Beirut/North
Life Science,False,True,False,False,False,True,"Communication, Chemistry, Analysis, Biology, Time Management","Pharmacology, Biochemistry, Summer Program",Lab/Research,"patient care, to build",Faculty of Pharmacy,BS/PharmD,Pharmacy,Beirut/North
Life Science,False,True,False,True,False,True,"Mathematics, Attention to Detail, Biology, English, Arabic","Pharmaceutics, TOEFL",Lab/Research,"healthcare, to research",Faculty of Pharmacy,BS/PharmD,Pharmacy,Beirut/North
