High-school Track,R,I,A,S,E,C,Skills,Courses and Certificates,Work Style,Passion and Goals,Faculty,Typical Degree,Program/Major,Primary Campus
Arts and Humanities,False,True,True,True,False,False,"Critical Thinking, Analysis, English","British Literature, Creative Writing, Summer Program","People-centric/Teaching, Office/Data","teaching, to lead",Faculty of Letters & Human Sciences,"BA, MA, PhD",English Language & Literature,5 branches across provinces
Arts and Humanities,False,True,True,True,False,False,"Critical Thinking, Communication, Analysis, Linguistics, Time Management","American Literature, Summer Program",People-centric/Teaching,"writing, to create",Faculty of Letters & Human Sciences,"BA, MA, PhD",English Language & Literature,5 branches across provinces
Arts and Humanities,False,True,True,True,False,False,"Communication, Critical Thinking, Analysis, Research, English, Time Management","Grammar, British Literature, TOEFL","People-centric/Teaching, Office/Data","writing, to build",Faculty of Letters & Human Sciences,"BA, MA, PhD",English Language & Literature,5 branches across provinces
Arts and Humanities,False,False,True,True,False,False,"Writing, Research, Linguistics, Communication, French, Arabic","British Literature, Literary Theory, TOEFL",People-centric/Teaching,"literature, career",Faculty of Letters & Human Sciences,"BA, MA, PhD",English Language & Literature,5 branches across provinces
Arts and Humanities,False,True,False,True,False,False,"Analysis, Communication, Linguistics, Arabic, Time Management","American Literature, British Literature, First Aid","People-centric/Teaching, Office/Data","culture, career",Faculty of Letters & Human Sciences,"BA, MA, PhD",English Language & Literature,5 branches across provinces
Arts and Humanities,False,True,True,True,True,False,"Critical Thinking, Analysis, Microsoft Office","British Literature, TOEFL",People-centric/Teaching,"literature, to help people",Faculty of Letters & Human Sciences,"BA, MA, PhD",English Language & Literature,5 branches across provinces
Arts and Humanities,False,True,True,False,False,False,"Analysis, Communication, Research, Communication","American Literature, Literary Theory, First Aid",People-centric/Teaching,"language, career",Faculty of Letters & Human Sciences,"BA, MA, PhD",English Language & Literature,5 branches across provinces
Arts and Humanities,False,True,True,True,False,False,"Communication, Linguistics, Writing, Critical Thinking, French, Communication","Creative Writing, Grammar, First Aid",People-centric/Teaching,"literature, to create",Faculty of Letters & Human Sciences,"BA, MA, PhD",English Language & Literature,5 branches across provinces
Arts and Humanities,False,True,True,True,False,False,"Analysis, Research, Arabic","Literary Theory, Summer Program",People-centric/Teaching,"literature, to research",Faculty of Letters & Human Sciences,"BA, MA, PhD",English Language & Literature,5 branches across provinces
Arts and Humanities,False,True,False,True,True,False,"Writing, Critical Thinking, Research, Communication, English","British Literature, Grammar, ICDL","People-centric/Teaching, Office/Data","teaching, to lead",Faculty of Letters & Human Sciences,"BA, MA, PhD",English Language & Literature,5 branches across provinces
Arts and Humanities,False,True,True,True,False,False,"Analysis, Research, Critical Thinking, Writing, Research, French","American Literature, Literary Theory, ICDL",People-centric/Teaching,"writing, to lead",Faculty of Letters & Human Sciences,"BA, MA, PhD",English Language & Literature,5 branches across provinces
Arts and Humanities,False,True,True,True,False,False,"Linguistics, Research, English","Grammar, TOEFL",People-centric/Teaching,"literature, to create",Faculty of Letters & Human Sciences,"BA, MA, PhD",English Language & Literature,5 branches across provinces
Arts and Humanities,False,False,True,True,False,False,"Analysis, Communication, Research, Time Management","French Literature, TOEFL",People-centric/Teaching,"language, to innovate",Faculty of Letters & Human Sciences,"BA, MA, PhD",French Language & Literature,5 branches across provinces
Arts and Humanities,False,False,True,False,False,False,"Communication, Analysis, Linguistics, Research, English","French Literature, First Aid",People-centric/Teaching,"communication, to help people",Faculty of Letters & Human Sciences,"BA, MA, PhD",French Language & Literature,5 branches across provinces
Arts and Humanities,False,True,True,True,True,False,"Analysis, Writing, Microsoft Office","Linguistics, First Aid",People-centric/Teaching,"french culture, to research",Faculty of Letters & Human Sciences,"BA, MA, PhD",French Language & Literature,5 branches across provinces
Arts and Humanities,False,True,True,True,False,False,"Analysis, Linguistics, Communication, Arabic","Linguistics, Francophone Cultures, First Aid",People-centric/Teaching,"communication, to research",Faculty of Letters & Human Sciences,"BA, MA, PhD",French Language & Literature,5 branches across provinces
Arts and Humanities,False,True,True,True,False,False,"Linguistics, Analysis, Writing, Time Management, Communication","French Literature, Linguistics, TOEFL",People-centric/Teaching,"literature, to create",Faculty of Letters & Human Sciences,"BA, MA, PhD",French Language & Literature,5 branches across provinces
Arts and Humanities,False,True,True,True,False,False,"Translation, French, French, Time Management","Translation Studies, police Workshop",People-centric/Teaching,"teaching, to build",Faculty of Letters & Human Sciences,"BA, MA, PhD",French Language & Literature,5 branches across provinces
Arts and Humanities,False,True,True,True,True,False,"Linguistics, Writing, English","Grammar, IELTS",People-centric/Teaching,"french culture, to help people",Faculty of Letters & Human Sciences,"BA, MA, PhD",French Language & Literature,5 branches across provinces
Arts and Humanities,False,True,True,True,False,False,"Translation, Writing, English, Research","Francophone Cultures, Translation Studies, capital Workshop",People-centric/Teaching,"communication, to understand",Faculty of Letters & Human Sciences,"BA, MA, PhD",French Language & Literature,5 branches across provinces
Arts and Humanities,False,True,True,True,False,False,"Communication, Linguistics, Translation, English","Francophone Cultures, IELTS","People-centric/Teaching, Office/Data","teaching, to build",Faculty of Letters & Human Sciences,"BA, MA, PhD",French Language & Literature,5 branches across provinces
Arts and Humanities,False,True,True,True,False,False,"Analysis, Translation, Communication, French, Arabic","French Literature, eat Workshop","People-centric/Teaching, Office/Data","literature, to create",Faculty of Letters & Human Sciences,"BA, MA, PhD",French Language & Literature,5 branches across provinces
Arts and Humanities,False,True,False,False,False,False,"Translation, Linguistics, French, Writing, Microsoft Office, French","French Literature, Francophone Cultures, talk Workshop",People-centric/Teaching,"communication, to research",Faculty of Letters & Human Sciences,"BA, MA, PhD",French Language & Literature,5 branches across provinces
Arts and Humanities,False,True,True,True,False,False,"Translation, Analysis, Research, Time Management","Francophone Cultures, Grammar, ICDL","People-centric/Teaching, Office/Data","literature, career",Faculty of Letters & Human Sciences,"BA, MA, PhD",French Language & Literature,5 branches across provinces
Arts and Humanities,False,True,True,True,True,False,"Translation, Writing, French","Linguistics, Francophone Cultures, thought Workshop",People-centric/Teaching,"language, to create",Faculty of Letters & Human Sciences,"BA, MA, PhD",French Language & Literature,5 branches across provinces
Arts and Humanities,False,True,True,True,False,False,"Analysis, French, Linguistics, Research","Linguistics, Francophone Cultures, First Aid",People-centric/Teaching,"literature, career",Faculty of Letters & Human Sciences,"BA, MA, PhD",French Language & Literature,5 branches across provinces
Arts and Humanities,False,True,True,True,False,True,"Communication, Analysis, English, Time Management","Linguistics, Grammar, TOEFL","People-centric/Teaching, Office/Data","language, to innovate",Faculty of Letters & Human Sciences,"BA, MA, PhD",French Language & Literature,5 branches across provinces
Arts and Humanities,False,False,True,True,False,False,"Analysis, Communication, Translation, French, Communication","Grammar, French Literature, Summer Program",People-centric/Teaching,"language, to innovate",Faculty of Letters & Human Sciences,"BA, MA, PhD",French Language & Literature,5 branches across provinces
Arts and Humanities,False,False,True,True,False,False,"Translation, Writing, Communication, French","Grammar, Translation Studies, IELTS",People-centric/Teaching,"teaching, to research",Faculty of Letters & Human Sciences,"BA, MA, PhD",French Language & Literature,5 branches across provinces
Arts and Humanities,True,True,True,True,False,False,"Analysis, Communication, Linguistics, Writing, Time Management","Linguistics, French Literature, responsibility Workshop","People-centric/Teaching, Office/Data","language, to build",Faculty of Letters & Human Sciences,"BA, MA, PhD",French Language & Literature,5 branches across provinces
Life Science,False,True,False,True,False,False,"Listening, Statistics, Communication, Research","Abnormal Psychology, Introduction to Psychology, First Aid","Lab/Research, People-centric/Teaching","the mind, to build",Faculty of Letters & Human Sciences,"BA, MA, PhD",Psychology,5 branches across provinces
Life Science,False,False,False,True,True,False,"Communication, Research, Research","Research Methods, TOEFL",Lab/Research,"research, to research",Faculty of Letters & Human Sciences,"BA, MA, PhD",Psychology,5 branches across provinces
Life Science,False,True,False,True,False,True,"Analysis, Research, Communication, Listening, Research, Time Management","Introduction to Psychology, Research Methods, First Aid","Lab/Research, People-centric/Teaching","human behavior, to innovate",Faculty of Letters & Human Sciences,"BA, MA, PhD",Psychology,5 branches across provinces
Life Science,False,True,False,True,False,False,"Research, Statistics, Arabic, Microsoft Office","Abnormal Psychology, Statistics, Summer Program","Lab/Research, People-centric/Teaching","counseling, to research",Faculty of Letters & Human Sciences,"BA, MA, PhD",Psychology,5 branches across provinces
Life Science,False,True,False,True,False,False,"Analysis, Communication, Research","Statistics, Research Methods, give Workshop",Lab/Research,"mental health, to lead",Faculty of Letters & Human Sciences,"BA, MA, PhD",Psychology,5 branches across provinces
Life Science,False,True,False,True,False,False,"Statistics, Analysis, Communication, Research, English","Introduction to Psychology, Statistics, First Aid",Lab/Research,"research, to help people",Faculty of Letters & Human Sciences,"BA, MA, PhD",Psychology,5 branches across provinces
Life Science,False,True,False,True,False,False,"Communication, Research, Statistics, Analysis, Communication","Statistics, Introduction to Psychology, TOEFL","Lab/Research, People-centric/Teaching","helping people, to help people",Faculty of Letters & Human Sciences,"BA, MA, PhD",Psychology,5 branches across provinces
Life Science,False,True,False,False,False,False,"Analysis, Communication, Research, Empathy, Communication, Arabic","Research Methods, Abnormal Psychology, IELTS","Lab/Research, People-centric/Teaching","helping people, to build",Faculty of Letters & Human Sciences,"BA, MA, PhD",Psychology,5 branches across provinces
Life Science,False,False,False,True,False,False,"Empathy, Listening, Analysis, Communication, Research","Statistics, IELTS","Lab/Research, People-centric/Teaching","human behavior, to research",Faculty of Letters & Human Sciences,"BA, MA, PhD",Psychology,5 branches across provinces
Life Science,False,True,False,False,False,False,"Statistics, Analysis, Arabic","Statistics, Research Methods, Summer Program",Lab/Research,"counseling, to understand",Faculty of Letters & Human Sciences,"BA, MA, PhD",Psychology,5 branches across provinces
Life Science,True,True,False,True,False,True,"Empathy, Communication, Analysis, Communication, French","Introduction to Psychology, IELTS",Lab/Research,"the mind, to help people",Faculty of Letters & Human Sciences,"BA, MA, PhD",Psychology,5 branches across provinces
Life Science,False,True,False,False,False,False,"Research, Statistics, Communication, Research","Developmental Psychology, Research Methods, ICDL","Lab/Research, People-centric/Teaching","the mind, to research",Faculty of Letters & Human Sciences,"BA, MA, PhD",Psychology,5 branches across provinces
Life Science,True,True,False,True,False,False,"Empathy, Communication, Statistics, Research, Communication, English","Statistics, ICDL",Lab/Research,"the mind, to build",Faculty of Letters & Human Sciences,"BA, MA, PhD",Psychology,5 branches across provinces
Life Science,False,True,False,True,False,False,"Analysis, Listening, Communication, Research","Statistics, Developmental Psychology, IELTS","Lab/Research, People-centric/Teaching","mental health, to build",Faculty of Letters & Human Sciences,"BA, MA, PhD",Psychology,5 branches across provinces
Life Science,False,False,True,True,False,True,"Listening, Communication, Analysis, Statistics, Microsoft Office","Statistics, Research Methods, issue Workshop",Lab/Research,"the mind, to build",Faculty of Letters & Human Sciences,"BA, MA, PhD",Psychology,5 branches across provinces
Life Science,False,True,False,True,False,False,"Research, Analysis, Listening, Statistics, English","Introduction to Psychology, First Aid",Lab/Research,"counseling, career",Faculty of Letters & Human Sciences,"BA, MA, PhD",Psychology,5 branches across provinces
Life Science,False,True,False,True,False,False,"Statistics, Listening, Analysis, Communication, Arabic, French","Statistics, First Aid","Lab/Research, People-centric/Teaching","counseling, to help people",Faculty of Letters & Human Sciences,"BA, MA, PhD",Psychology,5 branches across provinces
Life Science,False,True,False,True,False,False,"Analysis, Research, Statistics, Communication, Microsoft Office","Abnormal Psychology, Developmental Psychology, First Aid",Lab/Research,"research, to help people",Faculty of Letters & Human Sciences,"BA, MA, PhD",Psychology,5 branches across provinces
Arts and Humanities,False,True,False,False,False,True,"Communication, Writing, Critical Thinking, Research, Communication, French","Historiography, ICDL",Lab/Research,"past, career",Faculty of Letters & Human Sciences,"BA, MA, PhD",History,5 branches across provinces
Arts and Humanities,False,True,False,True,True,True,"Analysis, Critical Thinking, Research, Writing, French, English","Lebanese History, Historiography, Summer Program",Lab/Research,"culture, to understand",Faculty of Letters & Human Sciences,"BA, MA, PhD",History,5 branches across provinces
Arts and Humanities,False,True,False,False,False,True,"Writing, Critical Thinking, Memory, Analysis, Arabic","World History, eight Workshop","Lab/Research, Office/Data","analysis, to innovate",Faculty of Letters & Human Sciences,"BA, MA, PhD",History,5 branches across provinces
Arts and Humanities,False,True,False,False,True,True,"Research, Analysis, Communication, Communication","Lebanese History, Historiography, ICDL","Lab/Research, Office/Data","research, to build",Faculty of Letters & Human Sciences,"BA, MA, PhD",History,5 branches across provinces
Arts and Humanities,False,True,False,False,False,True,"Writing, Research, French","Lebanese History, ICDL",Lab/Research,"past, to research",Faculty of Letters & Human Sciences,"BA, MA, PhD",History,5 branches across provinces
Arts and Humanities,False,False,False,False,False,False,"Memory, Research, Arabic","Lebanese History, World History, TOEFL","Lab/Research, Office/Data","past, to lead",Faculty of Letters & Human Sciences,"BA, MA, PhD",History,5 branches across provinces
Arts and Humanities,False,True,True,False,False,True,"Communication, Analysis, Research","Historical Research Methods, Summer Program",Lab/Research,"heritage, to research",Faculty of Letters & Human Sciences,"BA, MA, PhD",History,5 branches across provinces
Arts and Humanities,False,True,False,False,True,True,"Writing, Critical Thinking, Memory, Research, Research","Lebanese History, Archaeology, First Aid",Lab/Research,"past, to build",Faculty of Letters & Human Sciences,"BA, MA, PhD",History,5 branches across provinces
Arts and Humanities,False,True,False,False,False,True,"Memory, Critical Thinking, Communication, Arabic","Archaeology, TOEFL",Lab/Research,"research, career",Faculty of Letters & Human Sciences,"BA, MA, PhD",History,5 branches across provinces
Arts and Humanities,False,False,False,False,False,True,"Memory, Critical Thinking, Microsoft Office","Historiography, TOEFL","Lab/Research, Office/Data","heritage, to research",Faculty of Letters & Human Sciences,"BA, MA, PhD",History,5 branches across provinces
Arts and Humanities,True,True,False,False,False,True,"Communication, Analysis, Time Management, Arabic","World History, IELTS",Lab/Research,"heritage, to help people",Faculty of Letters & Human Sciences,"BA, MA, PhD",History,5 branches across provinces
Arts and Humanities,False,True,False,False,False,True,"Critical Thinking, Communication, Communication","Historical Research Methods, Summer Program",Lab/Research,"culture, to research",Faculty of Letters & Human Sciences,"BA, MA, PhD",History,5 branches across provinces
Arts and Humanities,False,True,False,False,False,True,"Critical Thinking, Writing, Microsoft Office, Communication","Historical Research Methods, Lebanese History, Summer Program","Lab/Research, Office/Data","analysis, to build",Faculty of Letters & Human Sciences,"BA, MA, PhD",History,5 branches across provinces
Arts and Humanities,False,True,True,False,True,True,"Writing, Critical Thinking, French","Historiography, Historical Research Methods, TOEFL",Lab/Research,"culture, career",Faculty of Letters & Human Sciences,"BA, MA, PhD",History,5 branches across provinces
Arts and Humanities,False,True,True,False,False,True,"Research, Analysis, Writing, Arabic, French","Lebanese History, Summer Program",Lab/Research,"heritage, to innovate",Faculty of Letters & Human Sciences,"BA, MA, PhD",History,5 branches across provinces
Arts and Humanities,False,True,False,False,False,True,"Memory, Analysis, Critical Thinking, Communication, Arabic, Microsoft Office","Lebanese History, First Aid",Lab/Research,"research, to understand",Faculty of Letters & Human Sciences,"BA, MA, PhD",History,5 branches across provinces
Arts and Humanities,False,True,False,False,False,True,"Analysis, Memory, Critical Thinking, Research, Research","Historical Research Methods, World History, First Aid",Lab/Research,"analysis, career",Faculty of Letters & Human Sciences,"BA, MA, PhD",History,5 branches across provinces
Arts and Humanities,False,True,False,False,False,True,"Communication, Critical Thinking, English, Arabic","Archaeology, First Aid","Lab/Research, Office/Data","culture, career",Faculty of Letters & Human Sciences,"BA, MA, PhD",History,5 branches across provinces
Sociology and Economics,False,False,False,False,True,True,"Data Analysis, Programming, Excel, Communication, French","IT Management, IELTS",Office/Data,"management, to research",Faculty of Economics & Business Administration,BS,Management & Information Systems (MIS),Multiple branches
Sociology and Economics,False,True,False,False,True,True,"Communication, Data Analysis, Programming, Microsoft Office, Communication","IT Management, Database Management, Summer Program","Office/Data, Business","data systems, to innovate",Faculty of Economics & Business Administration,BS,Management & Information Systems (MIS),Multiple branches
Sociology and Economics,False,False,False,False,True,True,"Communication, Business, Problem Solving, Excel, Microsoft Office","Database Management, Business Intelligence, ICDL","Office/Data, Business","IT solutions, to innovate",Faculty of Economics & Business Administration,BS,Management & Information Systems (MIS),Multiple branches
Sociology and Economics,True,False,False,False,True,True,"Excel, Business, Problem Solving, Communication, French, Time Management","Project Management, TOEFL",Office/Data,"management, to lead",Faculty of Economics & Business Administration,BS,Management & Information Systems (MIS),Multiple branches
Sociology and Economics,False,False,False,False,True,True,"Excel, Problem Solving, Arabic, French","Project Management, IT Management, ICDL","Office/Data, Business","efficiency, career",Faculty of Economics & Business Administration,BS,Management & Information Systems (MIS),Multiple branches
Sociology and Economics,False,False,False,True,True,True,"Problem Solving, Communication, Excel, Time Management","Business Intelligence, Database Management, ICDL",Office/Data,"IT solutions, to create",Faculty of Economics & Business Administration,BS,Management & Information Systems (MIS),Multiple branches
Sociology and Economics,False,False,True,False,True,True,"Business, Excel, Communication, Programming, Time Management, Communication","Database Management, Project Management, TOEFL",Office/Data,"business technology, to understand",Faculty of Economics & Business Administration,BS,Management & Information Systems (MIS),Multiple branches
Sociology and Economics,False,False,False,False,True,True,"Problem Solving, Data Analysis, Programming, English","Database Management, IT Management, ICDL",Office/Data,"business technology, to create",Faculty of Economics & Business Administration,BS,Management & Information Systems (MIS),Multiple branches
Sociology and Economics,False,False,False,False,False,True,"Data Analysis, Business, Excel, Communication, Arabic, Microsoft Office","Database Management, Systems Analysis, thank Workshop",Office/Data,"efficiency, to understand",Faculty of Economics & Business Administration,BS,Management & Information Systems (MIS),Multiple branches
Sociology and Economics,False,False,False,False,True,True,"Excel, Programming, Business, Data Analysis, Time Management, Microsoft Office","Systems Analysis, TOEFL",Office/Data,"IT solutions, to innovate",Faculty of Economics & Business Administration,BS,Management & Information Systems (MIS),Multiple branches
Sociology and Economics,False,False,False,False,True,True,"Excel, Problem Solving, Communication, Communication, Time Management","Project Management, ICDL","Office/Data, Business","efficiency, to research",Faculty of Economics & Business Administration,BS,Management & Information Systems (MIS),Multiple branches
Sociology and Economics,False,False,False,True,True,True,"Problem Solving, Programming, Research","Business Intelligence, Summer Program","Office/Data, Business","data systems, to research",Faculty of Economics & Business Administration,BS,Management & Information Systems (MIS),Multiple branches
Sociology and Economics,False,False,False,True,True,True,"Data Analysis, Problem Solving, Business, Excel, French","Project Management, Summer Program",Office/Data,"IT solutions, career",Faculty of Economics & Business Administration,BS,Management & Information Systems (MIS),Multiple branches
Sociology and Economics,False,False,False,False,True,True,"Excel, Data Analysis, Programming, Microsoft Office","Database Management, Business Intelligence, ICDL",Office/Data,"business technology, to build",Faculty of Economics & Business Administration,BS,Management & Information Systems (MIS),Multiple branches
Sociology and Economics,False,False,False,False,True,True,"Programming, Data Analysis, Time Management","IT Management, better Workshop",Office/Data,"data systems, to lead",Faculty of Economics & Business Administration,BS,Management & Information Systems (MIS),Multiple branches
Sociology and Economics,False,True,False,False,True,True,"Programming, Excel, Communication, Microsoft Office","Systems Analysis, IELTS",Office/Data,"data systems, to create",Faculty of Economics & Business Administration,BS,Management & Information Systems (MIS),Multiple branches
Sociology and Economics,False,False,False,False,True,False,"Programming, Problem Solving, Business, Arabic","IT Management, ICDL","Office/Data, Business","efficiency, to build",Faculty of Economics & Business Administration,BS,Management & Information Systems (MIS),Multiple branches
Sociology and Economics,True,False,False,False,True,True,"Business, Programming, English","IT Management, Project Management, TOEFL",Office/Data,"IT solutions, to understand",Faculty of Economics & Business Administration,BS,Management & Information Systems (MIS),Multiple branches
Sociology and Economics,False,False,False,False,False,True,"Organization, Excel, Arabic, English","Financial Accounting, test Workshop",Office/Data,"organization, to research",Faculty of Economics & Business Administration,BS,Accounting,Multiple branches
Sociology and Economics,False,False,False,False,False,False,"Analysis, Excel, Organization, French","Bookkeeping, Taxation, Summer Program",Office/Data,"corporate, to help people",Faculty of Economics & Business Administration,BS,Accounting,Multiple branches
Sociology and Economics,False,False,False,False,False,True,"Accounting Software, Organization, Research, English","Bookkeeping, Summer Program",Office/Data,"corporate, to lead",Faculty of Economics & Business Administration,BS,Accounting,Multiple branches
Sociology and Economics,False,False,False,False,False,True,"Analysis, Attention to Detail, Organization, Mathematics, Microsoft Office","Managerial Accounting, First Aid",Office/Data,"finance, to create",Faculty of Economics & Business Administration,BS,Accounting,Multiple branches
